{
  "schema_version": 1,
  "golden_version": "rag-demo-1.0.0",
  "target": "rag-project",
  "notes": "Converted from the question files in https://github.com/Nbhaskell/rag-project by tools/convert_ragproject.py. 'tuned' items were used while the prompt and thresholds were adjusted, so scores on them flatter the system. 'heldout' items were written afterwards and not used to tune, but were written by Claude from the documents (per that project's README), so they are unseen by the prompt, not blind to the corpus. No item is 'ambiguous' or 'conflicting' yet, and no item has a reference_answer.",
  "corpus": {
    "name": "demo_docs",
    "source": "https://github.com/Nbhaskell/rag-project",
    "commit": "cb4ebe02355e9e62866178141f451596078bb8aa",
    "documents": {
      "01-vaccination-and-health-requirements.md": "bf3f8dc5d5c7807303ca8b54fcee6721f44d0cadae89c0d73ac825c62c97635d",
      "02-temperament-and-admission-policy.md": "aeed1d0a0b879011fea17d21bc30a1a30def38fba47d47252caf0ef71e346642",
      "03-pricing-and-packages.md": "49edc11b6c3e5853c8177d19309baa94148f995e7bbbe4d321e79840493571a8",
      "04-hours-and-schedule.md": "f838938b9876eea3391ebb4cd32fe192943d179e007c2668c7e950e77cc53c19",
      "05-daily-routine.md": "830410d110423d553c3ba73fc53f351c9cef80d6cb53cca762e167f6b81a5206",
      "06-cancellation-payment-and-refund-policy.md": "57f64bd6dd774af7b4300c3d12350e93dde6673a6413b3ec70fc1c694fcdb373",
      "07-visitor-guide.pdf": "21ae79bf0887f0cc79b9e78a21d142c37c1dbcc712a25aaf42466b39723c9a9f"
    }
  },
  "items": [
    {
      "id": "vaccines-required",
      "split": "tuned",
      "category": "factual",
      "question": "Which vaccinations does my dog need before attending?",
      "expected_abstain": false,
      "evidence": [
        {
          "anchor": "Bordetella, also called kennel cough",
          "passages": [
            {
              "doc_id": "01-vaccination-and-health-requirements.md",
              "section": "Barks n Woofs: Vaccination and Health Requirements > Required Vaccinations",
              "page": null,
              "text": "- Bordetella, also called kennel cough (must be given within the last 12 months)"
            }
          ]
        }
      ],
      "answer_contains": [
        [
          "rabies"
        ],
        [
          "dhpp",
          "distemper"
        ],
        [
          "bordetella",
          "kennel cough"
        ]
      ],
      "origin": {
        "file": "eval_questions.json",
        "id": "vaccines-required"
      }
    },
    {
      "id": "flu-vaccine",
      "split": "tuned",
      "category": "yes_no",
      "question": "Is the canine influenza vaccine required?",
      "expected_abstain": false,
      "evidence": [
        {
          "anchor": "Canine influenza: recommended",
          "passages": [
            {
              "doc_id": "01-vaccination-and-health-requirements.md",
              "section": "Barks n Woofs: Vaccination and Health Requirements > Required Vaccinations",
              "page": null,
              "text": "- Canine influenza: recommended"
            }
          ]
        }
      ],
      "answer_contains": [
        [
          "no",
          "not required",
          "recommended"
        ]
      ],
      "answer_not_contains": [
        "yes"
      ],
      "notes": "It is only recommended, so the answer is no.",
      "origin": {
        "file": "eval_questions.json",
        "id": "flu-vaccine"
      }
    },
    {
      "id": "rabies-valid",
      "split": "tuned",
      "category": "factual",
      "question": "How long is a rabies vaccination valid for?",
      "expected_abstain": false,
      "evidence": [
        {
          "anchor": "Rabies (valid for 3 years",
          "passages": [
            {
              "doc_id": "01-vaccination-and-health-requirements.md",
              "section": "Barks n Woofs: Vaccination and Health Requirements > Required Vaccinations",
              "page": null,
              "text": "- Rabies (valid for 3 years, depending on the vaccine given)"
            }
          ]
        }
      ],
      "answer_contains": [
        [
          "3 years",
          "three years"
        ]
      ],
      "origin": {
        "file": "eval_questions.json",
        "id": "rabies-valid"
      }
    },
    {
      "id": "paper-photo",
      "split": "tuned",
      "category": "yes_no",
      "question": "Can I send a photo of my dog's paper vaccination records?",
      "expected_abstain": false,
      "evidence": [
        {
          "anchor": "Photos of paper records are not accepted",
          "passages": [
            {
              "doc_id": "01-vaccination-and-health-requirements.md",
              "section": "Barks n Woofs: Vaccination and Health Requirements > How to Provide Proof",
              "page": null,
              "text": "Owners must send vaccination records from their veterinarian by email address,  in person or by online form. Records must show the dog's name, the vaccine, the date given, and the date it expires. Photos of paper records are not accepted."
            }
          ]
        }
      ],
      "answer_contains": [
        [
          "no",
          "not accepted",
          "cannot",
          "can't"
        ]
      ],
      "answer_not_contains": [
        "yes"
      ],
      "notes": "Photos of paper records are not accepted.",
      "origin": {
        "file": "eval_questions.json",
        "id": "paper-photo"
      }
    },
    {
      "id": "grace-period",
      "split": "tuned",
      "category": "factual",
      "question": "Is there a grace period if my dog's vaccination expires?",
      "expected_abstain": false,
      "evidence": [
        {
          "anchor": "grace period of 5 days",
          "passages": [
            {
              "doc_id": "01-vaccination-and-health-requirements.md",
              "section": "Barks n Woofs: Vaccination and Health Requirements > Expired Vaccinations",
              "page": null,
              "text": "If a dog's vaccination expires, the dog cannot attend until updated proof is received. We do allow a grace period of 5 days."
            }
          ]
        }
      ],
      "answer_contains": [
        [
          "5 days",
          "five days"
        ]
      ],
      "origin": {
        "file": "eval_questions.json",
        "id": "grace-period"
      }
    },
    {
      "id": "sick-wait",
      "split": "tuned",
      "category": "factual",
      "question": "How long after being sick can my dog come back?",
      "expected_abstain": false,
      "evidence": [
        {
          "anchor": "may return after 2 days, or with a vet's note",
          "passages": [
            {
              "doc_id": "01-vaccination-and-health-requirements.md",
              "section": "Barks n Woofs: Vaccination and Health Requirements > Sick Dog Policy",
              "page": null,
              "text": "Do not bring your dog if they have had any of these in the last 48 hours: vomiting, diarrhea, coughing, sneezing, eye or nose discharge, fever, or open wounds. Dogs showing signs of illness during the day will be separated and the owner will be called for pickup within 1 hour. A dog who has been ill may return after 2 days, or with a vet's note."
            }
          ]
        }
      ],
      "answer_contains": [
        [
          "2 days",
          "two days"
        ],
        [
          "vet's note",
          "vet note",
          "note from"
        ]
      ],
      "origin": {
        "file": "eval_questions.json",
        "id": "sick-wait"
      }
    },
    {
      "id": "sick-symptom-window",
      "split": "tuned",
      "category": "factual",
      "question": "How many hours without vomiting or diarrhea before I can bring my dog?",
      "expected_abstain": false,
      "evidence": [
        {
          "anchor": "in the last 48 hours",
          "passages": [
            {
              "doc_id": "01-vaccination-and-health-requirements.md",
              "section": "Barks n Woofs: Vaccination and Health Requirements > Sick Dog Policy",
              "page": null,
              "text": "Do not bring your dog if they have had any of these in the last 48 hours: vomiting, diarrhea, coughing, sneezing, eye or nose discharge, fever, or open wounds. Dogs showing signs of illness during the day will be separated and the owner will be called for pickup within 1 hour. A dog who has been ill may return after 2 days, or with a vet's note."
            }
          ]
        }
      ],
      "answer_contains": [
        [
          "48"
        ]
      ],
      "notes": "Symptoms in the last 48 hours mean stay home.",
      "origin": {
        "file": "eval_questions.json",
        "id": "sick-symptom-window"
      }
    },
    {
      "id": "neuter-age",
      "split": "tuned",
      "category": "factual",
      "question": "At what age does my dog have to be spayed or neutered?",
      "expected_abstain": false,
      "evidence": [
        {
          "anchor": "Dogs over 6 months old must be spayed or neutered",
          "passages": [
            {
              "doc_id": "01-vaccination-and-health-requirements.md",
              "section": "Barks n Woofs: Vaccination and Health Requirements > Spay and Neuter Requirements",
              "page": null,
              "text": "Dogs over 6 months old must be spayed or neutered to attend. Female dogs in heat cannot attend."
            }
          ]
        }
      ],
      "answer_contains": [
        [
          "6 months",
          "six months"
        ]
      ],
      "origin": {
        "file": "eval_questions.json",
        "id": "neuter-age"
      }
    },
    {
      "id": "unneutered-8mo",
      "split": "tuned",
      "category": "edge_case",
      "question": "My dog is 8 months old and not neutered. Can he attend?",
      "expected_abstain": false,
      "evidence": [
        {